{
  "schema_version": "1.0.0",
  "artifact_id": "art_out_discover_runtime_surface",
  "report_kind": "runtime-surface",
  "worker_id": "discover-runtime-surface",
  "worker_version": "0.1.0",
  "title": "discover-runtime-surface discovery report",
  "summary": "Sample discovery-report payload for discover-runtime-surface.",
  "findings": [
    {
      "id": "sample-finding",
      "severity": "info",
      "message": "Sample finding for discover-runtime-surface",
      "path": "workers/discover-runtime-surface"
    }
  ],
  "inventory": {
    "worker_id": "discover-runtime-surface",
    "report_kind": "runtime-surface"
  },
  "gaps": [
    {
      "id": "sample-gap",
      "severity": "low",
      "description": "Executable runtime still deferred for Discovery Workers",
      "suggested_owner": "core"
    }
  ],
  "status": "ready",
  "created_at": "2026-08-01T06:00:00Z",
  "trace": {
    "orchestration_id": "art_discovery_orchestration",
    "plan_id": "art_discovery_plan",
    "task_id": "art_task_discover_runtime_surface",
    "run_id": "art_run_discover_runtime_surface",
    "goal_id": "art_discovery_goal"
  }
}
